<?xml version="1.0" encoding="UTF-8"?>
<!DOCTYPE songsheet SYSTEM "http://people.ee.ethz.ch/~maroggo/musik/schrumm.dtd">
<?xml-stylesheet type="text/css" href="http://people.ee.ethz.ch/~maroggo/musik/schrumm.css" ?>

<songsheet>
<info>
	<title>Schrumm-Markup</title>
	<composer>Matthias</composer>
	
	<year>2011</year>
	<genre>Yet Antother Chord Markup Language</genre>
	
	<note>Kommentare im Infobereich müssen immer am Schluss stehen</note>
	
</info>

<song>
	<stanza type="verse">
		Die <chord name="H" />Strophen werden nummeriert<br />
		I got no place of my <chord name="H" />own<br />
		Well I got nothing to <chord name="em" />give<br />
		Well I got nothing to <chord name="H" />show for it
	</stanza>
	
	<stanza type="bridge">
		And I'll be wondering <chord name="D" />all, for all my <chord name="em" />years<br />
		What I be<chord name="H" />come no one could <chord name="am" />know
	</stanza>
	<stanza type="chorus">
		If you're <chord name="em" />feeling what I'm feeling <chord name="H" />c'mon<br />
		All you soul searching people <chord name="em" />c'mon
	</stanza>
	
	<note>Und jetzt: ALLE!</note>
	
	<stanza type="verse">
		...wobei Bridge und Refrain nicht gezählt werden<br />
		I got no place of my <chord name="H" />own<br />
		Well I got nothing to <chord name="em" />give<br />
		Well I got nothing to <chord name="H" />show for it
	</stanza>
	
	<note>Klappt noch nicht: Akkordfolge ohne Text</note>

</song>
</songsheet>